{
  "schemaVersion": "GoldenFixtureMetadataV1",
  "fixtureId": "pdf-hidden-ocr",
  "source": {
    "path": "fixtures/golden/synthetic/pdf/pdf-hidden-ocr.pdf",
    "sha256": "f7d55e5dc5d18ec0d374f695fa6bd339e1b656ad26eaf647e8f66557eb3ad840",
    "sizeBytes": 7702,
    "format": "pdf"
  },
  "expected": {
    "pageRoles": [
      {
        "pageIndex": 1,
        "roles": [
          "visual_review",
          "question"
        ]
      }
    ],
    "taskGroups": [
      {
        "id": "group-1",
        "displayRange": [
          1,
          3
        ],
        "kind": "true_false_not_given",
        "slotIds": [
          "q1",
          "q2",
          "q3"
        ]
      }
    ],
    "slots": [
      {
        "id": "q1",
        "displayNumber": "1",
        "responseType": "radio"
      },
      {
        "id": "q2",
        "displayNumber": "2",
        "responseType": "radio"
      },
      {
        "id": "q3",
        "displayNumber": "3",
        "responseType": "radio"
      }
    ],
    "assets": [
      {
        "id": "page-1-raster",
        "type": "page_image",
        "required": true
      }
    ]
  },
  "knownIssues": [
    "The page contains an image plus a hidden text layer; native/OCR provenance must be retained."
  ],
  "baseline": {
    "v1Path": "fixtures/golden/baseline/v1/pdf-hidden-ocr.json",
    "observed": {
      "pageCount": 1,
      "blockCount": 1,
      "groupCount": 1,
      "slotCount": 1,
      "assetCount": 0,
      "answerCount": 1,
      "warningCount": 0,
      "groupKinds": [
        "true_false_not_given"
      ],
      "questionIds": [
        "q1"
      ],
      "roles": [
        "question"
      ]
    }
  }
}
