{
  "schemaVersion": "GoldenFixtureMetadataV1",
  "fixtureId": "pdf-question-before-passage",
  "source": {
    "path": "fixtures/golden/synthetic/pdf/pdf-question-before-passage.pdf",
    "sha256": "14f46523e91bc0d8f828f5d42d3432bea51431614b3b66c16b0fbdc1a7c68f6a",
    "sizeBytes": 2050,
    "format": "pdf"
  },
  "expected": {
    "pageRoles": [
      {
        "pageIndex": 1,
        "roles": [
          "question",
          "passage"
        ]
      },
      {
        "pageIndex": 2,
        "roles": [
          "passage"
        ]
      }
    ],
    "taskGroups": [
      {
        "id": "group-1",
        "displayRange": [
          1,
          3
        ],
        "kind": "heading_matching",
        "slotIds": [
          "q1",
          "q2",
          "q3"
        ]
      }
    ],
    "slots": [
      {
        "id": "q1",
        "displayNumber": "1",
        "responseType": "select"
      },
      {
        "id": "q2",
        "displayNumber": "2",
        "responseType": "select"
      },
      {
        "id": "q3",
        "displayNumber": "3",
        "responseType": "select"
      }
    ],
    "assets": []
  },
  "knownIssues": [
    "Questions appear on page 1 and the passage on page 2; physical order is not semantic order."
  ],
  "baseline": {
    "v1Path": "fixtures/golden/baseline/v1/pdf-question-before-passage.json",
    "observed": {
      "pageCount": 2,
      "blockCount": 11,
      "groupCount": 1,
      "slotCount": 3,
      "assetCount": 0,
      "answerCount": 3,
      "warningCount": 0,
      "groupKinds": [
        "matching"
      ],
      "questionIds": [
        "q1",
        "q2",
        "q3"
      ],
      "roles": [
        "passage",
        "question"
      ]
    }
  }
}
