{
  "schemaVersion": "GoldenFixtureMetadataV1",
  "fixtureId": "sleep-study",
  "source": {
    "path": "fixtures/golden/private-real/sleep-study.pdf",
    "originalName": "139. P1 - Sleep Study on Modern-Day Hunter-Gatherers Dispels Popular Notions 部落睡眠研究.pdf",
    "sha256": "1c7262c8726850398c20c84d63310143180877979cd8b3705e654c55a5e9b7b2",
    "sizeBytes": 905744,
    "format": "pdf"
  },
  "expected": {
    "pageRoles": [
      {
        "pageIndex": 1,
        "roles": [
          "passage"
        ]
      },
      {
        "pageIndex": 2,
        "roles": [
          "passage"
        ]
      },
      {
        "pageIndex": 3,
        "roles": [
          "question"
        ]
      },
      {
        "pageIndex": 4,
        "roles": [
          "question"
        ]
      },
      {
        "pageIndex": 5,
        "roles": [
          "explanation"
        ]
      },
      {
        "pageIndex": 6,
        "roles": [
          "answer"
        ]
      }
    ],
    "taskGroups": [
      {
        "id": "group-1",
        "displayRange": [
          1,
          4
        ],
        "kind": "true_false_not_given",
        "slotIds": [
          "q1",
          "q2",
          "q3",
          "q4"
        ],
        "responseGroupIds": [
          "group-1-responses"
        ],
        "sourceEvidenceIds": [
          "group-1-source"
        ]
      },
      {
        "id": "group-2",
        "displayRange": [
          5,
          13
        ],
        "kind": "note_completion",
        "slotIds": [
          "q5",
          "q6",
          "q7",
          "q8",
          "q9",
          "q10",
          "q11",
          "q12",
          "q13"
        ],
        "responseGroupIds": [
          "group-2-responses"
        ],
        "sourceEvidenceIds": [
          "group-2-source"
        ]
      }
    ],
    "slots": [
      {
        "id": "q1",
        "displayNumber": "1",
        "responseType": "radio"
      },
      {
        "id": "q2",
        "displayNumber": "2",
        "responseType": "radio"
      },
      {
        "id": "q3",
        "displayNumber": "3",
        "responseType": "radio"
      },
      {
        "id": "q4",
        "displayNumber": "4",
        "responseType": "radio"
      },
      {
        "id": "q5",
        "displayNumber": "5",
        "responseType": "text"
      },
      {
        "id": "q6",
        "displayNumber": "6",
        "responseType": "text"
      },
      {
        "id": "q7",
        "displayNumber": "7",
        "responseType": "text"
      },
      {
        "id": "q8",
        "displayNumber": "8",
        "responseType": "text"
      },
      {
        "id": "q9",
        "displayNumber": "9",
        "responseType": "text"
      },
      {
        "id": "q10",
        "displayNumber": "10",
        "responseType": "text"
      },
      {
        "id": "q11",
        "displayNumber": "11",
        "responseType": "text"
      },
      {
        "id": "q12",
        "displayNumber": "12",
        "responseType": "text"
      },
      {
        "id": "q13",
        "displayNumber": "13",
        "responseType": "text"
      }
    ],
    "assets": [
      {
        "id": "answer-explanation-raster",
        "type": "answer_explanation_page_raster",
        "required": true
      }
    ],
    "optionBanks": [
      {
        "id": "group-1-option-bank",
        "taskGroupId": "group-1",
        "scope": "task_group",
        "labels": [
          "TRUE",
          "FALSE",
          "NOT GIVEN"
        ],
        "allowReuse": true,
        "sourceEvidenceIds": [
          "group-1-source"
        ]
      }
    ],
    "responseGroups": [
      {
        "id": "group-1-responses",
        "taskGroupId": "group-1",
        "slotIds": [
          "q1",
          "q2",
          "q3",
          "q4"
        ],
        "promptMode": "per_slot",
        "cardinality": {
          "min": 1,
          "max": 1,
          "exact": 1
        },
        "assignment": "per_slot",
        "optionBinding": {
          "mode": "option_bank",
          "optionBankId": "group-1-option-bank"
        },
        "reusePolicy": "allowed",
        "scoringPolicy": "per_slot_binary",
        "sourceEvidenceIds": [
          "group-1-source"
        ]
      },
      {
        "id": "group-2-responses",
        "taskGroupId": "group-2",
        "slotIds": [
          "q5",
          "q6",
          "q7",
          "q8",
          "q9",
          "q10",
          "q11",
          "q12",
          "q13"
        ],
        "promptMode": "embedded",
        "cardinality": {
          "min": 1,
          "max": 1,
          "exact": 1
        },
        "assignment": "per_slot",
        "optionBinding": {
          "mode": "none"
        },
        "reusePolicy": "not_applicable",
        "scoringPolicy": "per_slot_ielts_normalized",
        "sourceEvidenceIds": [
          "group-2-source"
        ]
      }
    ],
    "sourceEvidence": [
      {
        "id": "group-1-source",
        "evidenceType": "source_text",
        "pageIndexes": [
          3
        ],
        "references": [
          "fixtures/golden/private-real/sleep-study.pdf#page=3"
        ]
      },
      {
        "id": "group-2-source",
        "evidenceType": "source_text",
        "pageIndexes": [
          4
        ],
        "references": [
          "fixtures/golden/private-real/sleep-study.pdf#page=4"
        ]
      }
    ],
    "runtimeExpectations": {
      "authoritativeVersion": "v1",
      "artifactMode": "shadow_only",
      "compileExpectation": "structure_must_compile",
      "loaderExpectation": "test_only",
      "rendererExpectation": "test_only",
      "scoringExpectation": "per_slot",
      "productionExposure": "disabled",
      "requiredFeatureFlags": {
        "documentIrV2Shadow": false,
        "authoringV2Shadow": false,
        "qualityGateV2": false,
        "runtimeSourceV2": false,
        "nasPackageV2": false
      }
    }
  },
  "knownIssues": [
    "Answer and disputed-answer explanation pages must remain separate from passage and question content."
  ],
  "review": {
    "status": "approved",
    "reviewedBy": "phase0-source-audit",
    "reviewedAt": "2026-08-10",
    "method": "source-text-evidence",
    "evidence": [
      "fixtures/golden/private/legacy-reference.json"
    ]
  },
  "baseline": {
    "v1Path": "fixtures/golden/baseline/v1/sleep-study.json",
    "observed": {
      "pageCount": 6,
      "blockCount": 59,
      "groupCount": 2,
      "slotCount": 13,
      "assetCount": 0,
      "answerCount": 13,
      "warningCount": 1,
      "groupKinds": [
        "true_false_not_given",
        "sentence_completion"
      ],
      "questionIds": [
        "q1",
        "q2",
        "q3",
        "q4",
        "q5",
        "q6",
        "q7",
        "q8",
        "q9",
        "q10",
        "q11",
        "q12",
        "q13"
      ],
      "roles": [
        "answer",
        "passage",
        "question"
      ]
    }
  }
}
