{
  "schemaVersion": "GoldenFixtureMetadataV1",
  "fixtureId": "pdf-header-footer",
  "source": {
    "path": "fixtures/golden/synthetic/pdf/pdf-header-footer.pdf",
    "sha256": "88f8c0b0605c6bbd230671f85c57ec57085cfb9739ef415fb2fbae7a5751ce2a",
    "sizeBytes": 2118,
    "format": "pdf"
  },
  "expected": {
    "pageRoles": [
      {
        "pageIndex": 1,
        "roles": [
          "passage",
          "question",
          "header",
          "footer"
        ]
      },
      {
        "pageIndex": 2,
        "roles": [
          "passage"
        ]
      }
    ],
    "taskGroups": [
      {
        "id": "group-1",
        "displayRange": [
          1,
          3
        ],
        "kind": "summary_completion",
        "slotIds": [
          "q1",
          "q2",
          "q3"
        ]
      }
    ],
    "slots": [
      {
        "id": "q1",
        "displayNumber": "1",
        "responseType": "text"
      },
      {
        "id": "q2",
        "displayNumber": "2",
        "responseType": "text"
      },
      {
        "id": "q3",
        "displayNumber": "3",
        "responseType": "text"
      }
    ],
    "assets": []
  },
  "knownIssues": [
    "Repeated header/footer text must not be assigned to passage content."
  ],
  "baseline": {
    "v1Path": "fixtures/golden/baseline/v1/pdf-header-footer.json",
    "observed": {
      "pageCount": 2,
      "blockCount": 13,
      "groupCount": 1,
      "slotCount": 3,
      "assetCount": 0,
      "answerCount": 3,
      "warningCount": 0,
      "groupKinds": [
        "summary_completion"
      ],
      "questionIds": [
        "q1",
        "q2",
        "q3"
      ],
      "roles": [
        "passage",
        "question"
      ]
    }
  }
}
