{
  "schemaVersion": "GoldenFixtureMetadataV1",
  "fixtureId": "docx-table-merged-cells",
  "source": {
    "path": "fixtures/golden/synthetic/docx/docx-table-merged-cells.docx",
    "sha256": "7c8c28e736464025ad036cc488d7155cedad9895dc5d22f7c5aab028928ab1aa",
    "sizeBytes": 2147,
    "format": "docx"
  },
  "expected": {
    "pageRoles": [
      {
        "pageIndex": 1,
        "roles": [
          "question",
          "table"
        ]
      }
    ],
    "taskGroups": [
      {
        "id": "group-1",
        "displayRange": [
          1,
          4
        ],
        "kind": "table_completion",
        "slotIds": [
          "q1",
          "q2",
          "q3",
          "q4"
        ]
      }
    ],
    "slots": [
      {
        "id": "q1",
        "displayNumber": "1",
        "responseType": "text"
      },
      {
        "id": "q2",
        "displayNumber": "2",
        "responseType": "text"
      },
      {
        "id": "q3",
        "displayNumber": "3",
        "responseType": "text"
      },
      {
        "id": "q4",
        "displayNumber": "4",
        "responseType": "text"
      }
    ],
    "assets": []
  },
  "knownIssues": [
    "Merged cells and grid spans must remain explicit in the table IR."
  ],
  "baseline": {
    "v1Path": "fixtures/golden/baseline/v1/docx-table-merged-cells.json",
    "observed": {
      "pageCount": 1,
      "blockCount": 3,
      "groupCount": 1,
      "slotCount": 4,
      "assetCount": 0,
      "answerCount": 4,
      "warningCount": 0,
      "groupKinds": [
        "short_answer"
      ],
      "questionIds": [
        "q1",
        "q2",
        "q3",
        "q4"
      ],
      "roles": [
        "question"
      ]
    }
  }
}
