{
  "schemaVersion": "GoldenFixtureMetadataV1",
  "fixtureId": "docx-external-image",
  "source": {
    "path": "fixtures/golden/synthetic/docx/docx-external-image.docx",
    "sha256": "159086c86df69395b2920a809282a743717c8dbca7a18ac7816a6e2255343d93",
    "sizeBytes": 2492,
    "format": "docx"
  },
  "expected": {
    "pageRoles": [
      {
        "pageIndex": 1,
        "roles": [
          "visual_review"
        ]
      }
    ],
    "taskGroups": [],
    "slots": [],
    "assets": [
      {
        "id": "external-image-1",
        "type": "external_image",
        "required": true
      }
    ]
  },
  "knownIssues": [
    "The image relationship targets an unavailable external resource and must block formal publish."
  ],
  "baseline": {
    "v1Path": "fixtures/golden/baseline/v1/docx-external-image.json",
    "observed": {
      "pageCount": 1,
      "blockCount": 1,
      "groupCount": 0,
      "slotCount": 0,
      "assetCount": 0,
      "answerCount": 0,
      "warningCount": 1,
      "groupKinds": [],
      "questionIds": [],
      "roles": []
    }
  },
  "sourceRevision": {
    "updatedAt": "2026-08-10",
    "reason": "Phase 3 OOXML adversarial fixtures intentionally regenerated with deterministic package parts",
    "generator": "scripts/generate-phase3-docx-fixtures.py",
    "supersedesSha256": "c4df41c183508292ec6153181ecf3b9f4137cccdd6a8d18be5b2ec416057ddca"
  }
}
