{
  "schemaVersion": "GoldenFixtureMetadataV1",
  "fixtureId": "chili-peppers",
  "source": {
    "path": "fixtures/golden/private-real/chili-peppers.pdf",
    "originalName": "7. P1 - Chili peppers 辣椒的历史.pdf",
    "sha256": "f4e70c39b51cff44115e93f0e4dcdaff6ab35b10478869720b7dc549d0b4f602",
    "sizeBytes": 552135,
    "format": "pdf"
  },
  "expected": {
    "pageRoles": [
      {
        "pageIndex": 1,
        "roles": [
          "passage"
        ]
      },
      {
        "pageIndex": 2,
        "roles": [
          "passage"
        ]
      },
      {
        "pageIndex": 3,
        "roles": [
          "question"
        ]
      },
      {
        "pageIndex": 4,
        "roles": [
          "question"
        ]
      },
      {
        "pageIndex": 5,
        "roles": [
          "answer"
        ]
      }
    ],
    "taskGroups": [
      {
        "id": "group-1",
        "displayRange": [
          1,
          6
        ],
        "kind": "true_false_not_given",
        "slotIds": [
          "q1",
          "q2",
          "q3",
          "q4",
          "q5",
          "q6"
        ],
        "responseGroupIds": [
          "group-1-responses"
        ],
        "sourceEvidenceIds": [
          "group-1-source"
        ]
      },
      {
        "id": "group-2",
        "displayRange": [
          7,
          13
        ],
        "kind": "note_completion",
        "slotIds": [
          "q7",
          "q8",
          "q9",
          "q10",
          "q11",
          "q12",
          "q13"
        ],
        "responseGroupIds": [
          "group-2-responses"
        ],
        "sourceEvidenceIds": [
          "group-2-source"
        ]
      }
    ],
    "slots": [
      {
        "id": "q1",
        "displayNumber": "1",
        "responseType": "radio"
      },
      {
        "id": "q2",
        "displayNumber": "2",
        "responseType": "radio"
      },
      {
        "id": "q3",
        "displayNumber": "3",
        "responseType": "radio"
      },
      {
        "id": "q4",
        "displayNumber": "4",
        "responseType": "radio"
      },
      {
        "id": "q5",
        "displayNumber": "5",
        "responseType": "radio"
      },
      {
        "id": "q6",
        "displayNumber": "6",
        "responseType": "radio"
      },
      {
        "id": "q7",
        "displayNumber": "7",
        "responseType": "text"
      },
      {
        "id": "q8",
        "displayNumber": "8",
        "responseType": "text"
      },
      {
        "id": "q9",
        "displayNumber": "9",
        "responseType": "text"
      },
      {
        "id": "q10",
        "displayNumber": "10",
        "responseType": "text"
      },
      {
        "id": "q11",
        "displayNumber": "11",
        "responseType": "text"
      },
      {
        "id": "q12",
        "displayNumber": "12",
        "responseType": "text"
      },
      {
        "id": "q13",
        "displayNumber": "13",
        "responseType": "text"
      }
    ],
    "assets": [
      {
        "id": "passage-embedded-image",
        "type": "passage_image",
        "required": true
      }
    ],
    "optionBanks": [
      {
        "id": "group-1-option-bank",
        "taskGroupId": "group-1",
        "scope": "task_group",
        "labels": [
          "TRUE",
          "FALSE",
          "NOT GIVEN"
        ],
        "allowReuse": true,
        "sourceEvidenceIds": [
          "group-1-source"
        ]
      }
    ],
    "responseGroups": [
      {
        "id": "group-1-responses",
        "taskGroupId": "group-1",
        "slotIds": [
          "q1",
          "q2",
          "q3",
          "q4",
          "q5",
          "q6"
        ],
        "promptMode": "per_slot",
        "cardinality": {
          "min": 1,
          "max": 1,
          "exact": 1
        },
        "assignment": "per_slot",
        "optionBinding": {
          "mode": "option_bank",
          "optionBankId": "group-1-option-bank"
        },
        "reusePolicy": "allowed",
        "scoringPolicy": "per_slot_binary",
        "sourceEvidenceIds": [
          "group-1-source"
        ]
      },
      {
        "id": "group-2-responses",
        "taskGroupId": "group-2",
        "slotIds": [
          "q7",
          "q8",
          "q9",
          "q10",
          "q11",
          "q12",
          "q13"
        ],
        "promptMode": "embedded",
        "cardinality": {
          "min": 1,
          "max": 1,
          "exact": 1
        },
        "assignment": "per_slot",
        "optionBinding": {
          "mode": "none"
        },
        "reusePolicy": "not_applicable",
        "scoringPolicy": "per_slot_ielts_normalized",
        "sourceEvidenceIds": [
          "group-2-source"
        ]
      }
    ],
    "sourceEvidence": [
      {
        "id": "group-1-source",
        "evidenceType": "source_text",
        "pageIndexes": [
          3
        ],
        "references": [
          "fixtures/golden/private-real/chili-peppers.pdf#page=3"
        ]
      },
      {
        "id": "group-2-source",
        "evidenceType": "source_text",
        "pageIndexes": [
          4
        ],
        "references": [
          "fixtures/golden/private-real/chili-peppers.pdf#page=4"
        ]
      }
    ],
    "runtimeExpectations": {
      "authoritativeVersion": "v1",
      "artifactMode": "shadow_only",
      "compileExpectation": "structure_must_compile",
      "loaderExpectation": "test_only",
      "rendererExpectation": "test_only",
      "scoringExpectation": "per_slot",
      "productionExposure": "disabled",
      "requiredFeatureFlags": {
        "documentIrV2Shadow": false,
        "authoringV2Shadow": false,
        "qualityGateV2": false,
        "runtimeSourceV2": false,
        "nasPackageV2": false
      }
    }
  },
  "knownIssues": [
    "V1 reports zero assets although the passage contains a significant embedded image."
  ],
  "review": {
    "status": "approved",
    "reviewedBy": "phase0-source-audit",
    "reviewedAt": "2026-08-10",
    "method": "source-text-evidence",
    "evidence": [
      "fixtures/golden/private/legacy-reference.json"
    ]
  },
  "baseline": {
    "v1Path": "fixtures/golden/baseline/v1/chili-peppers.json",
    "observed": {
      "pageCount": 5,
      "blockCount": 56,
      "groupCount": 2,
      "slotCount": 13,
      "assetCount": 0,
      "answerCount": 13,
      "warningCount": 1,
      "groupKinds": [
        "true_false_not_given",
        "sentence_completion"
      ],
      "questionIds": [
        "q1",
        "q2",
        "q3",
        "q4",
        "q5",
        "q6",
        "q7",
        "q8",
        "q9",
        "q10",
        "q11",
        "q12",
        "q13"
      ],
      "roles": [
        "passage",
        "question"
      ]
    }
  }
}
